{
  "itemProposals": [
    {
      "bbox": [
        0,
        0,
        31,
        33
      ],
      "coordinateSpace": "source_pixel",
      "footprintCandidate": {
        "heightCells": 1,
        "widthCells": 1
      },
      "occupiedCells": [
        [
          0,
          0
        ]
      ],
      "primitive": {
        "implementationPath": "core/settlement_item_recognizer.py",
        "implementationSha256": "32dc8b0175adc9560a81213370bf2d6c975377101441942dea42bfd7681c3f1e",
        "invocationVersion": "settlement-component-export-v1",
        "name": "SettlementItemRecognizer._segment_occupied_components",
        "runtimeDependencies": {
          "numpy": "2.2.6",
          "opencv": "5.0.0"
        },
        "version": "source-sha256:32dc8b0175adc9560a81213370bf2d6c975377101441942dea42bfd7681c3f1e"
      },
      "proposalId": "proposal-3f6968ebc9be50c2e62d",
      "rawProposalEvidence": {
        "col": 0,
        "occupiedCount": 1,
        "rarityObservation": "green",
        "rarityScore": 0.365234,
        "row": 0,
        "shape": "1x1"
      },
      "trackId": null
    },
    {
      "bbox": [
        31,
        0,
        61,
        33
      ],
      "coordinateSpace": "source_pixel",
      "footprintCandidate": {
        "heightCells": 1,
        "widthCells": 1
      },
      "occupiedCells": [
        [
          0,
          1
        ]
      ],
      "primitive": {
        "implementationPath": "core/settlement_item_recognizer.py",
        "implementationSha256": "32dc8b0175adc9560a81213370bf2d6c975377101441942dea42bfd7681c3f1e",
        "invocationVersion": "settlement-component-export-v1",
        "name": "SettlementItemRecognizer._segment_occupied_components",
        "runtimeDependencies": {
          "numpy": "2.2.6",
          "opencv": "5.0.0"
        },
        "version": "source-sha256:32dc8b0175adc9560a81213370bf2d6c975377101441942dea42bfd7681c3f1e"
      },
      "proposalId": "proposal-26fe77b641ff1cf7efa9",
      "rawProposalEvidence": {
        "col": 1,
        "occupiedCount": 1,
        "rarityObservation": "green",
        "rarityScore": 0.309524,
        "row": 0,
        "shape": "1x1"
      },
      "trackId": null
    },
    {
      "bbox": [
        61,
        0,
        92,
        33
      ],
      "coordinateSpace": "source_pixel",
      "footprintCandidate": {
        "heightCells": 1,
        "widthCells": 1
      },
      "occupiedCells": [
        [
          0,
          2
        ]
      ],
      "primitive": {
        "implementationPath": "core/settlement_item_recognizer.py",
        "implementationSha256": "32dc8b0175adc9560a81213370bf2d6c975377101441942dea42bfd7681c3f1e",
        "invocationVersion": "settlement-component-export-v1",
        "name": "SettlementItemRecognizer._segment_occupied_components",
        "runtimeDependencies": {
          "numpy": "2.2.6",
          "opencv": "5.0.0"
        },
        "version": "source-sha256:32dc8b0175adc9560a81213370bf2d6c975377101441942dea42bfd7681c3f1e"
      },
      "proposalId": "proposal-a35f496a1b87ba304b7e",
      "rawProposalEvidence": {
        "col": 2,
        "occupiedCount": 1,
        "rarityObservation": "green",
        "rarityScore": 0.337891,
        "row": 0,
        "shape": "1x1"
      },
      "trackId": null
    },
    {
      "bbox": [
        92,
        0,
        123,
        33
      ],
      "coordinateSpace": "source_pixel",
      "footprintCandidate": {
        "heightCells": 1,
        "widthCells": 1
      },
      "occupiedCells": [
        [
          0,
          3
        ]
      ],
      "primitive": {
        "implementationPath": "core/settlement_item_recognizer.py",
        "implementationSha256": "32dc8b0175adc9560a81213370bf2d6c975377101441942dea42bfd7681c3f1e",
        "invocationVersion": "settlement-component-export-v1",
        "name": "SettlementItemRecognizer._segment_occupied_components",
        "runtimeDependencies": {
          "numpy": "2.2.6",
          "opencv": "5.0.0"
        },
        "version": "source-sha256:32dc8b0175adc9560a81213370bf2d6c975377101441942dea42bfd7681c3f1e"
      },
      "proposalId": "proposal-7439879df6b916a00aea",
      "rawProposalEvidence": {
        "col": 3,
        "occupiedCount": 1,
        "rarityObservation": "blue",
        "rarityScore": 0.351562,
        "row": 0,
        "shape": "1x1"
      },
      "trackId": null
    },
    {
      "bbox": [
        123,
        0,
        154,
        33
      ],
      "coordinateSpace": "source_pixel",
      "footprintCandidate": {
        "heightCells": 1,
        "widthCells": 1
      },
      "occupiedCells": [
        [
          0,
          4
        ]
      ],
      "primitive": {
        "implementationPath": "core/settlement_item_recognizer.py",
        "implementationSha256": "32dc8b0175adc9560a81213370bf2d6c975377101441942dea42bfd7681c3f1e",
        "invocationVersion": "settlement-component-export-v1",
        "name": "SettlementItemRecognizer._segment_occupied_components",
        "runtimeDependencies": {
          "numpy": "2.2.6",
          "opencv": "5.0.0"
        },
        "version": "source-sha256:32dc8b0175adc9560a81213370bf2d6c975377101441942dea42bfd7681c3f1e"
      },
      "proposalId": "proposal-1cfde6cb3957c5a74a51",
      "rawProposalEvidence": {
        "col": 4,
        "occupiedCount": 1,
        "rarityObservation": "blue",
        "rarityScore": 0.447266,
        "row": 0,
        "shape": "1x1"
      },
      "trackId": null
    },
    {
      "bbox": [
        154,
        0,
        184,
        33
      ],
      "coordinateSpace": "source_pixel",
      "footprintCandidate": {
        "heightCells": 1,
        "widthCells": 1
      },
      "occupiedCells": [
        [
          0,
          5
        ]
      ],
      "primitive": {
        "implementationPath": "core/settlement_item_recognizer.py",
        "implementationSha256": "32dc8b0175adc9560a81213370bf2d6c975377101441942dea42bfd7681c3f1e",
        "invocationVersion": "settlement-component-export-v1",
        "name": "SettlementItemRecognizer._segment_occupied_components",
        "runtimeDependencies": {
          "numpy": "2.2.6",
          "opencv": "5.0.0"
        },
        "version": "source-sha256:32dc8b0175adc9560a81213370bf2d6c975377101441942dea42bfd7681c3f1e"
      },
      "proposalId": "proposal-51edcfdcacbdf055489e",
      "rawProposalEvidence": {
        "col": 5,
        "occupiedCount": 1,
        "rarityObservation": "blue",
        "rarityScore": 0.402778,
        "row": 0,
        "shape": "1x1"
      },
      "trackId": null
    },
    {
      "bbox": [
        184,
        0,
        215,
        33
      ],
      "coordinateSpace": "source_pixel",
      "footprintCandidate": {
        "heightCells": 1,
        "widthCells": 1
      },
      "occupiedCells": [
        [
          0,
          6
        ]
      ],
      "primitive": {
        "implementationPath": "core/settlement_item_recognizer.py",
        "implementationSha256": "32dc8b0175adc9560a81213370bf2d6c975377101441942dea42bfd7681c3f1e",
        "invocationVersion": "settlement-component-export-v1",
        "name": "SettlementItemRecognizer._segment_occupied_components",
        "runtimeDependencies": {
          "numpy": "2.2.6",
          "opencv": "5.0.0"
        },
        "version": "source-sha256:32dc8b0175adc9560a81213370bf2d6c975377101441942dea42bfd7681c3f1e"
      },
      "proposalId": "proposal-e2c85dd8e1f3b6a2cfe6",
      "rawProposalEvidence": {
        "col": 6,
        "occupiedCount": 1,
        "rarityObservation": "blue",
        "rarityScore": 0.548828,
        "row": 0,
        "shape": "1x1"
      },
      "trackId": null
    },
    {
      "bbox": [
        215,
        0,
        246,
        33
      ],
      "coordinateSpace": "source_pixel",
      "footprintCandidate": {
        "heightCells": 1,
        "widthCells": 1
      },
      "occupiedCells": [
        [
          0,
          7
        ]
      ],
      "primitive": {
        "implementationPath": "core/settlement_item_recognizer.py",
        "implementationSha256": "32dc8b0175adc9560a81213370bf2d6c975377101441942dea42bfd7681c3f1e",
        "invocationVersion": "settlement-component-export-v1",
        "name": "SettlementItemRecognizer._segment_occupied_components",
        "runtimeDependencies": {
          "numpy": "2.2.6",
          "opencv": "5.0.0"
        },
        "version": "source-sha256:32dc8b0175adc9560a81213370bf2d6c975377101441942dea42bfd7681c3f1e"
      },
      "proposalId": "proposal-42f8be36ecf5587cce57",
      "rawProposalEvidence": {
        "col": 7,
        "occupiedCount": 1,
        "rarityObservation": "blue",
        "rarityScore": 0.443359,
        "row": 0,
        "shape": "1x1"
      },
      "trackId": null
    },
    {
      "bbox": [
        246,
        0,
        276,
        99
      ],
      "coordinateSpace": "source_pixel",
      "footprintCandidate": {
        "heightCells": 3,
        "widthCells": 1
      },
      "occupiedCells": [
        [
          0,
          8
        ],
        [
          1,
          8
        ],
        [
          2,
          8
        ]
      ],
      "primitive": {
        "implementationPath": "core/settlement_item_recognizer.py",
        "implementationSha256": "32dc8b0175adc9560a81213370bf2d6c975377101441942dea42bfd7681c3f1e",
        "invocationVersion": "settlement-component-export-v1",
        "name": "SettlementItemRecognizer._segment_occupied_components",
        "runtimeDependencies": {
          "numpy": "2.2.6",
          "opencv": "5.0.0"
        },
        "version": "source-sha256:32dc8b0175adc9560a81213370bf2d6c975377101441942dea42bfd7681c3f1e"
      },
      "proposalId": "proposal-7f75bfbaa2fa78bc7c87",
      "rawProposalEvidence": {
        "col": 8,
        "occupiedCount": 3,
        "rarityObservation": "gold",
        "rarityScore": 0.524471,
        "row": 0,
        "shape": "1x3"
      },